{
  "$schema": "https://schemas.opencryptotaxcommons.org/event/technical-transaction.schema.json",
  "technical_tx_id": "01J8Z3QKQ0TECHTX0100000000",
  "chain": "tezos",
  "block_height": 1594321,
  "block_time_utc": "2021-06-15T21:40:00.000Z",
  "operation_hash": "oo1SyntheticOperationHashForContractFixture0000000000",
  "op_index": 0,
  "from_address": "tz1SyntheticBuyerAddress00000000000000",
  "to_address": "KT1SyntheticMarketplaceContract0000000",
  "entrypoint": "collect",
  "token_transfers": [
    {
      "contract": "KT1SyntheticFa2TokenContract000000000",
      "token_id": "42",
      "amount": "1",
      "from": "tz1SyntheticSellerAddress0000000000000",
      "to": "tz1SyntheticBuyerAddress00000000000000"
    }
  ],
  "native_transfers": [
    { "amount": "87.5", "from": "tz1SyntheticBuyerAddress00000000000000", "to": "tz1SyntheticSellerAddress0000000000000" },
    { "amount": "10", "from": "tz1SyntheticBuyerAddress00000000000000", "to": "tz1SyntheticCreatorAddress000000000000" },
    { "amount": "2.5", "from": "tz1SyntheticBuyerAddress00000000000000", "to": "KT1SyntheticMarketplaceContract0000000" }
  ],
  "fees": [
    { "amount": "0.000512", "kind": "baker_fee", "payer": "tz1SyntheticBuyerAddress00000000000000" }
  ],
  "status": "applied",
  "source_evidence": ["01J8Z3QKQ0EVDENCE010000000"],
  "schema_version": "0.1.0"
}
